{"apiVersion":"labdns.dev/v1alpha1","kind":"LabDNS","metadata":{"name":"local-only"},"spec":{"access":{"clientGroups":[],"unknownClient":"refuse-forward"},"cache":{"enabled":false,"maxEntries":0,"maximumNegativeTTL":"0s","maximumTTL":"0s","minimumTTL":"0s","staleServing":false},"chaos":{"emergencyDisabled":false,"enabled":false,"policies":[],"safety":{}},"defaults":{"cnameDepth":8,"negativeTTL":"10s","ttl":"30s"},"forwarding":{"policies":[],"pools":[]},"listeners":{"dns":{"address":":5353","protocols":["udp","tcp"]},"management":{"address":":8080","mcpPath":"/mcp","restPath":"/v1"}},"management":{"auth":{"profile":"bearer"}},"observability":{"logQNAME":false},"ui":{"enabled":true},"zones":[{"id":"lab-zone","mode":"authoritative","name":"lab.example.net.","nameservers":["ns1.lab.example.net."],"records":[{"id":"ns1-a","owner":"ns1.lab.example.net.","ttl":"30s","type":"A","values":["10.42.0.53"]}],"soa":{"administrator":"hostmaster.lab.example.net.","expire":"24h","primary":"ns1.lab.example.net.","refresh":"1h","retry":"5m","serial":"auto"}}]}}
